{
  "schemaVersion": 1,
  "generatedAt": "2026-05-31T03:09:42Z",
  "bookId": "the-last-archive-vol-015",
  "format": "PROSE",
  "language": "en",
  "revision": "2026-05-31",
  "chapters": [
    {
      "index": 1,
      "title": "Vol-015, Chapter 1: The Prototype",
      "text": "The instrument occupied the full width of the monitoring hub's secondary workbench. Lian had requisitioned the bench three weeks before the completion, clearing it of the portable array components that had lived there since the prior depth-profile expedition — the clamps, the calibration rods, the water-resistant casing units that she had been refurbishing for months. The hub's overhead lights gave the instrument's casing a flat institutional shine. It was not beautiful. It was the size of a desk, and it looked like what it was: a functional reconstruction of something old, built to specification, without aesthetic concession.\n\nCorin arrived before the others. 0640, the day Lian had designated for the presentation. He stood at the workbench's edge and looked at the instrument for a long moment before Lian looked up from the calibration panel on its left side.\n\n\"It's finished,\" she said. Not as a greeting. As a statement of fact that had required three months to become true.\n\n\"When did you complete it?\"\n\n\"Yesterday evening. I ran the initial calibration at 2100. The readings were within tolerance.\" She stepped back from the panel and indicated the instrument's main body. \"I wanted the team to see it before I describe what it does.\"\n\nThe monitoring team arrived at 0700 in sequence: Tomas, who ran the fixed-array network; Petra, who managed the substrate data archive; Wyne, who had been on both eastern expeditions and had helped Lian design the portable arrays. Iris arrived with her documentation kit. She set it on the adjacent bench without asking for permission and opened the first blank form.\n\nLian waited until they had all oriented to the room. Then she began.\n\n\"The instrument is a reconstruction of a pre-Reckoner substrate monitoring device,\" she said. \"The specifications existed in the foundational archive documentation that Cross located four months ago. Cross gave us access to the full set — not just the field notes, the engineering documents. What I built is a close reconstruction using current materials where the original components were no longer available, and salvaged pre-Reckoner components where they were.\" She touched the instrument's casing at two points. \"The sensor housing and the depth calibration mechanism are original. The signal processing components are current fabrication, matched to the pre-Reckoner specifications as closely as our materials allow.\"\n\nTomas was looking at the cable assembly at the instrument's base — a coil of thick cable, roughly forty meters, with the sensor array at its end. \"That's a vertical sensor.\"\n\n\"Yes. The pre-Reckoner instruments were designed for vertical deployment, not lateral array. The principle is the same as a well bore — you drill a bore to depth and you lower the cable. The cable is the measurement instrument. The surface unit is the processing and display station.\" She indicated the display panel on the instrument's right side. \"This shows you what the cable reads.\"\n\n\"The portable arrays are lateral,\" Wyne said.\n\n\"Yes. They read the substrate in the horizontal plane. They're designed to map substrate anomalies across territory. This instrument reads the substrate in the vertical plane — depth by depth. It was designed to read the Resonance Layer, which is below the substrate. The lateral arrays can't reach it. Their design doesn't allow it.\" She paused. \"The Reckoner network's infrastructure replaced these instruments for a reason. The Reckoner network monitors the Resonance Layer from above — from the surface level, through its own distributed architecture. These instruments read the Layer directly, from below the substrate. The Reckoner network's designers decided the direct-read approach was unnecessary once the network was established.\" She stopped. \"That decision made sense at the time. The network had full Layer access. There was no need for instruments that went below the substrate.\"\n\n\"There is now,\" Iris said. She was writing.\n\n\"There is now,\" Lian said. \"The network's Layer access is compromised. The entity's activity below 40 meters is not readable by any current monitoring instrument. The portable arrays reach 35 meters in field conditions. The fixed arrays reach 40 meters in the field, though the Citadel's substrate geometry limits them to approximately 28 to 30 meters here. The Layer begins at approximately 40 meters in the eastern communities' territory, based on the pre-Reckoner documentation and the entity's substrate signal behavior at depth.\"\n\nShe moved to the display panel. \"I want to show you what the instrument reads at the Citadel's substrate.\" She activated the display. A frequency curve appeared — amber, following the familiar sinusoidal pattern that every person in the room had seen in the substrate monitoring data since their first day working in the hub. The pattern of the Citadel's deep ground, the substrate signal that had been documented since the Archive's founding. \"That's at 20 meters. The Citadel's substrate at 20 meters. Consistent with the fixed-array data.\" She adjusted the depth indicator. \"30 meters.\" The curve shifted slightly — the amplitude decreased, the frequency tightened — but remained amber, remained recognizable. \"This is the deepest the fixed arrays can read here, at the Citadel. The substrate continues below. It does not change character significantly until —\" She adjusted the indicator again.\n\nThe curve changed.\n\nIt was not a gradual change. At 32 meters the amber began to desaturate. At 35 meters it shifted. At 42 meters the curve on the display was white and translucent blue — not the amber of the substrate, but a different register entirely. The frequency pattern itself was different: more complex, oscillating at a rate that the substrate signal never approached.\n\nThe room was quiet.\n\n\"That is 42 meters,\" Lian said. \"The floor of the instrument workshop, through the concrete and the bedrock. I ran the cable through the bore I drilled for this test. At 42 meters, the instrument's display stops showing the substrate signal and shows this.\" She let the display run. The white and translucent blue frequencies moved in a slow, cycling pattern — not random, not noise, something structured and patient. \"The pre-Reckoner founding documentation uses a specific term for this. 'The Layer's primary register.' The founding monitoring teams, the engineers who built the first instruments of this type, they described it as follows.\" She had the text memorized. She had read it many times. \"'The Layer is not a deeper substrate but a qualitatively distinct zone. It occupies the same physical space as the substrate below a certain depth, but its physical properties and its signal properties differ from the substrate in every measurable dimension. The substrate is amber. The Layer is not.'\"\n\nWyne said: \"When they write 'amber,' they mean —\"\n\n\"The color the display shows. It's a display artifact from the original instrument's calibration — the substrate's base frequency maps to the amber register in the instrument's output. The Layer's base frequency maps to the white and blue register. These are what the instrument shows. Not metaphor. Not interpretation. What the display shows.\"\n\nPetra said: \"Has anyone seen this before? Since the pre-Reckoner period?\"\n\n\"No,\" Lian said. \"No Archive instrument has read the Layer's primary register since before the Reckoner network was established. The network's own monitoring architecture doesn't produce a display of this type. It processes the Layer signal into operational data — routing information, Resonance access parameters, the kind of data the Reckoners needed to do their operational work. What the Layer actually looks like in its primary register — this —\" she indicated the display \"— was last seen by the founding monitoring teams, approximately 80 years ago, before the Reckoner network came online.\"\n\n\"And at the coordinate,\" Corin said. He was looking at the display. He had not moved from his position at the workbench's edge.\n\n\"At the coordinate, the entity's signal extends below 40 meters into the Layer. Below 40 meters at that location, the instrument will show the Layer's primary register, plus whatever the entity's signal looks like in that register. We have never seen the entity's signal in the Layer's primary register. We have only ever seen it in the substrate.\" She paused. \"The theoretical maximum depth for this instrument is 120 meters. In field conditions, with the cable length I've built and the bore equipment we have, 80 meters is operational. We can read to 80 meters at the coordinate.\"\n\nThe field deployment was scheduled for the following week. Lian had already coordinated with the bore team. The logistics were settled. What remained was transport and execution.\n\nCorin had moved closer to the display during the explanation. He was at the workbench's edge now, close enough to read the depth indicator. He looked at the white and translucent blue frequencies cycling on the display and said: \"What did the founding monitoring team's documentation say about the signal at this particular coordinate?\"\n\n\"The pre-Reckoner mapping covered the eastern territory before the Eastern Field Calibration,\" Lian said. \"The coordinate is documented. I found three field notes referencing it specifically. The first describes it as a 'stable resonance node' — their terminology, from the Layer-monitoring vocabulary the founding teams used before the Reckoner network retasked the terminology for its operational purposes. The notation is marked as 'natural' — pre-existing, not created by a